,name,rating,date,upvotes,review
350,Shailja Dubey,2,"July 7, 2017",24,"The app is helpful to check public transport. I have just moved to Berlin from Mumbai, in Mumbai we have app to check all types of public transports operated. The best part of that app is it works offline unlike BVG app which makes it much more convenient to use. Also the m-indicater (Mumbai's app) has special feature for women security. BVG should work on their app to make it user friendly and must introduce security features for women."
351,Coman Hamilton,1,"October 10, 2017",4,"Without warning, the app automatically validates a ticket when being bought, meaning you waste a fare if you don't want to travel yet. BVG customer service is too poor to get money refunded."
352,Aaron Winn,2,"July 28, 2017",8,You need to check your app. I am unable to purchase tickets because I can't save the details required. Every time I tap save the fields for first and last name are wiped out.
353,Ahmed GHAZI,5,"October 27, 2017",2,"It's a great app for checking available connections and accurate in case of any delay on one of the lines always gives u alternatives, unfortunately it works only online, it would be great if it works offline too, I didn't use it for buying tickets"
354,Stephen Kent,1,"October 5, 2017",4,No stops found at given address ... which was Potsdamer Platz. Beyond useless.
355,Sebastian Gröbler,3,"October 18, 2017",6,"when buying items for less than 5,- I do not want to enter my cvv and all the 3d secure stuff all the time. this makes it more complicated than buying a ticket at the machine."
356,Mono Malt,5,"August 9, 2017",4,"Bisher wunderbar, seit heute schließt sich die App sofort wieder nach dem Öffnen. Cache, sowie Data Reset bringt auch nix... Bitte beheben! Besonders ärgerlich, weil ich es für die Tickets benötige :/"
357,Polina Montgomery,5,"July 27, 2017",5,I'm in Berlin for two months and this app really makes my life easier! It shows several routes and tells approximate time of your arrival
358,Daniel Robles,5,"July 6, 2017",5,"It is pretty nice! they have to continue working on that, there is still a few points to improve but it's already nice."
359,Regina Leuwer,1,"July 31, 2017",5,won't download my ticket even though i paid and have full connectivity
360,Wallace Shackleton,4,"July 16, 2017",4,Good app. Only let me down once and that was due to a poor signal. Good for getting around town.
361,Rekha V,4,"July 11, 2017",2,"Good app in general, but live positions of trams and buses can be horribly wrong sometimes"
362,Ivan Miskelic,5,"August 3, 2017",3,Mix of english and german? For short text info. Confusing.
363,Joachim Schuckmann,5,"September 29, 2017",3,Top App. Verwende sie seit 2 Jahren und hat bis jetzt immer gut geholfen.
364,A Google user,4,"August 20, 2017",3,Es wäre noch Supper falls die Fahrt Plan bleibt wenn ich zwischen Apps wechsle.
365,Werecynical Whywolf,5,"April 29, 2018",0,"Saved me a lot of time and prevented me from getting lost in Berlin. Thanks 
BVG"
366,Yassin K.,2,"October 26, 2017",0,"Widget ""Nearby Stops"" funktioniert nur über WLAN, nicht über mobiles Netz."
367,Raj S,4,"July 29, 2017",4,Decent app to get around in Berlin. Live map accuracy need to be improved.
368,Andrew Edinburgh,5,"July 15, 2017",2,"Quick, easy and an invaluable aid to the traveller to Berlin. A must have!"
369,Samuel Rydz-Wullens,1,"August 6, 2017",1,"First you enter all your personal info, the when you try to buy a ticket it steals your money without giving you a ticket."
370,Cameron McAlpine,4,"October 12, 2017",0,"Nice improvements. This app is the only way i buy tickets now. Would be cool to be able to buy multiple different tickets with one transaction, ie: bicycle and person."
371,A Google user,5,"August 4, 2017",4,Worked perfectly both in terms of ticket purchase and route planning.
372,The Goose lives on Good Vibes,5,"September 6, 2017",1,Great journey planner with times and platform information. Still using it as we speak. Very simple to use.
373,Fahmi Akbar,3,"July 25, 2017",6,it's quite a great app but many misplaced stations please fix it
374,Y Shawkat,1,"October 13, 2017",1,Fine app overall Single star because it keeps crashing everytime I start it Please fix it
375,A Google user,5,"August 23, 2017",2,Very useful for travelling and never had an issue with the online ticketing
376,A Google user,5,"December 9, 2017",0,This app helps me alot
377,Franz Rosenberg,5,"August 29, 2017",3,Super App. Must have für Berlin Touris
378,Jurgita Jurkaitė,5,"October 16, 2017",1,Perfect. I used it fir the firsy time when I was in Berlin. Clear and easy to use.
379,Rudy Cassol,5,"July 18, 2017",1,"If you like getting from point A to point B, this is the app for you"
380,Celine Birnholz,4,"August 15, 2017",3,More accurate than Google maps
381,Robert Schmidtke,4,"November 17, 2017",0,No option to change the language afaik. Will just assume the default language of your phone.
382,Hiren Thakkar,5,"July 13, 2017",2,It is best application for new people
383,Alexander Pastukhov,5,"October 7, 2017",0,A must have for Berlin public transport
384,A Google user,4,"July 13, 2017",2,It's pretty good.
385,Anatoly Korniltsev,5,"August 24, 2017",0,Can't sign up in the app. I am from russia.
386,Holger Sauerbrey,5,"September 19, 2017",0,Simpel und gut. Perfekt für die BVG.
387,A Google user,5,"October 6, 2017",2,Great app for basic transit information.
388,Learning Curve,5,"October 21, 2017",1,It works ok
389,Prasanna venkat.r,4,"October 31, 2017",1,Improve payment methods
390,sunshine Piao,4,"August 2, 2017",1,it's very useful and helpful
391,Joshua Rutter,5,"October 31, 2017",0,Does what it says on the box
392,A Google user,5,"October 19, 2017",0,May God Almighty bless you for creating this App.
393,Alex Toland,5,"September 18, 2017",1,Love BVG!
394,Nicky PrinceOfPop,5,"November 28, 2017",0,Thanks to you
395,Cristian Plutiş,5,"August 8, 2017",0,Sehr gut
396,Connor Caraluzzi,1,"September 29, 2017",0,Still can't buy tickets......
397,MD SABBIR Ahsan,5,"August 17, 2017",2,Very good
398,Jovansam,5,"July 30, 2017",2,Great app
399,julia shubs,5,"July 17, 2017",1,"Simply put, a lifesaver"
400,Dario Hagelberg,5,"July 13, 2017",2,Really Really Helpfully
401,A Google user,5,"July 30, 2017",1,Super
402,jesus antonio espinosa pineda,5,"November 5, 2017",0,Helpful app.
403,A Google user,5,"September 6, 2017",1,Excellent..
404,Sebastian Jamieson,5,"August 27, 2017",0,Love it!
405,Hussein Makram,4,"November 14, 2017",0,Perfect work
406,A Google user,5,"September 19, 2017",0,Fine
407,Tudor Kovacs,1,"June 27, 2017",3,"Completely useless. Doesn't save name and surname in login info and when you want to buy ticket, it asks you to write the names in an endless loop. Unusable."
408,Martin Dury,1,"June 28, 2017",4,"Useless! Attempting to buy tickets leads you into an endless loop of entering and re-entering your name and surname. Other parameters (address, phone number) are stored."
409,Mike Pettet,1,"June 24, 2017",4,Confusing for purchase of tickets. I You have to press ok several times to validate the 4AB tickets. Was fined 60 euros by abusive staff even though I bought the tickets
410,A Google user,5,"June 1, 2017",7,"Great app; super useful, just a bit slow at times. But happy with it overall, definitely a life saver."
411,Rahmantara Trichandi,4,"June 20, 2017",5,"Sometimes a bit of slow, otherwise really complete list of transportation and travel suggestion."
412,shitty violin,4,"May 26, 2017",4,"Usually quite reliable, easy to use. Can't quite live without."
413,Wei Chieh Tai,4,"June 21, 2017",5,It's very easy to use. Clear instructions and notes
414,Dennis Schmiege,5,"May 30, 2017",5,"Great app, displays everything you need to know in order to get from a to b in Berlin"
415,Antonio Moreno Ordóñez,5,"June 4, 2017",7,Easy to use and most of the times very accurate.
416,güldeniz şensoy,4,"May 31, 2017",8,"overall, it's a pretty practical app"
417,Miro Modric,5,"June 25, 2017",3,Good for travel in Berlin and buy Tickets.
418,Daanyew Daan,5,"June 29, 2017",2,Great to find your way in Berlin!
419,Ioannis Chiotakakos,3,"May 24, 2017",6,What happened to the logo?
420,john bahgat,5,"June 11, 2017",3,Very usefull app
421,Kristin Ahlbäck,5,"May 31, 2017",8,Allways works
422,Adrian Ambrinoc,5,"June 3, 2017",3,Beautyyyyyy
423,Michelle Howard,3,"March 4, 2017",25,I was controlled in the tram exactly when the app wasn't working. The result after many letters over and back that the bvg still insisted on over 100 euros. So basically I had to pay to test an app
424,A Google user,1,"March 5, 2017",47,"Very unreliable, fails randomly. And when it does, it may entitle you to a significant penalty fee, no excuses accepted. It should work flawlessly. Payments don't go though (just sometimes), app crashes, it logs you out occasionally.."
425,Valeria Wagner,1,"March 5, 2017",10,"App doesn't work after update. Tickets are not shown inside the app. Now, I can't buy it at all. What does format error after payment confirmation mean?  It is not pretty clear for user."
426,Ivan Enev / Иван Енев,5,"March 23, 2017",7,"An easy way to literally have Berlin's (and much of Brandenburg's) public transport right at the top of your fingers, and experience it in the smoothest way possible. Stunningly reliable! Many thanks for the effort to the developers."
427,Markus Rubey,1,"March 6, 2017",10,Unreliable! Can not login sometimes. Bought tickets don't show up.
428,A Google user,3,"March 30, 2017",1,"Does the job ok, but warns about cancellations only when reviewing the trip details (too late) and acts like there was no way to get to the closest S-Bahn from my home on foot (suggest I take the bus from further away(!) to get there)"
429,Wads Ex,5,"February 28, 2017",7,Need to improve map mode - its hard to navigate now while walking to the station.  But for all other features I am totally happy!
430,Alexander James Lovell,4,"March 24, 2017",3,"Insgesamt bin ich sehr zufrieden. Schön wäre es, wenn die Spracheinstellungen nicht automatisch wären. Auf Englisch ist übrigens die Bezeichnung des Netzplans S- &amp; U-Bahn falsch."
431,Umut Benzer,4,"February 20, 2017",9,Please add blue dot to show current location so we can navigate ourselves to station while walking.
432,A Google user,5,"April 1, 2017",5,"I only use it to check bus/sbahn times, and it has always been reliable for that."
433,Linda Dang,3,"April 14, 2017",3,Crashes too often when I want to check the details.
434,Maurice Van de Mosselaar,5,"March 30, 2017",3,I feel the best public city transport app ever made! Covers everything and fast
435,Igor S,2,"April 29, 2017",3,Search isn't reliable. Some messages are in German only.
436,A Google user,4,"March 30, 2017",1,It would be great if you add possibility to see a specific bus route on the map from start to finish
437,VOODOX,5,"April 2, 2017",2,Great for checking when and where to go. Tries its best to submit the shortest and most comfortable route.
438,uDon Griffin,5,"April 29, 2017",0,This app is my major tool when I visit Berlin. I would be totally lost without it. I travel through out the city and surrounding areas with it. Great app.
439,Aleksandra Shalibashvili,5,"May 2, 2017",1,I love this application. It helped me a lot with getting around Berlin.
440,tony o'donnell,4,"March 6, 2017",4,Very handy for timetables for a tourist in Berlin.
441,A Google user,5,"March 2, 2017",5,Simply the best app for public transportation in Berlin.
442,Henning Meyer,4,"April 1, 2017",1,"Ok, but should allow purchases of multiple tickets"
443,Rafael Leão,1,"March 7, 2017",1,It charged my account for a ticket a didn't buy
444,Sheikh Faisal Miskhat,5,"May 12, 2017",2,very helpful app for new berliners
445,Louise E,5,"March 1, 2017",4,"Excellent, helped me a lot on my trip"
446,Ammar Bandukwala,1,"March 23, 2017",2,Wont accept any cards
447,Christina Sorrells,4,"May 3, 2017",0,Als Fahrplanauskunft sehr zuverlässig.
448,Nycer,5,"March 18, 2017",4,Best App ever
449,Jurij Bersenev,5,"May 17, 2017",0,"Its great, but work on offline  would be valuable  ))"
450,Maria V,5,"April 18, 2017",2,Awesome app ❤
451,peter kuhl,5,"February 23, 2017",6,Brilliant app
452,Jameela Dyab,4,"April 12, 2017",3,Good app
453,Alex Riemer,4,"April 5, 2017",0,Always reliable for me
454,Jorge González González,5,"May 2, 2017",0,Good enough.
455,A Google user,5,"February 13, 2017",1,"Very useful app. Tip: Just need to be very methodical in selecting the correct names in the search criteria, which are well supported by the app. Can be a little daunting at first but get used to it and it's a brilliant app. Has saved my legs several times!"
456,Ovidiu Croitoru,1,"February 15, 2017",2,"Extremely dumb update where the location where the ticket becomes valid can no longer be chosen! I ended up waiting for minutes to get a ticket and I still haven't managed to get one. Also, BVG dummies... location doesn't work in Ubahn (underground)!"
457,Abouzar Hosseini,3,"February 7, 2017",4,"Opening other apps and switching back to it cause it to restart and lose searched routes. Also loading the names of stations for ""start"" and ""destination"" is slow! Though you can predefine some locations, you cannot use them as the ""start"" point of a route!"
458,Pavel Logacev,1,"February 17, 2017",0,"The app fails to download purchased tickets or even show them in the purchase history. As a result I ended up buying five tickets for a single trip, and, of course, none of them are being displayed."
459,Sophs,4,"February 10, 2017",0,"Praktisch, nur die Störungen werden nicht schnell genug aktualisiert oder erst gar nicht angezeigt."
460,Andrea Casalinga,5,"February 17, 2017",0,it works very well
461,Bruce Brenkus,5,"April 4, 2017",0,Fast and accurate
462,A Google user,2,"September 21, 2016",24,"This app is still a disappointment overall: very buggy, account sign-up to buy tickets failed several times before it finally worked. Cannot switch language to DE, am stuck with my phone's locale and the EN localization is comically poor. Overall the app seems cluttered and impractical. Frequent FCs. I'd much rather keep using DB Navigator for connections, but I want those mobile tickets."
463,Andreas F,2,"September 9, 2016",16,"The sign up process already sucks. No autocomplete/predictions enabled in the input fields. You do not really recognize, that you should check your emails, the form just keeps displayed. The mail contains a link that isn't clickable, the page that opens asks you for a start / stop location for a trip (though it confirmed your mail in the background apparently). Setting up a payment method seems only possible by ""almost"" purchasing a ticket at the same time. Whitespace in Iban / BIC do not get trimmed.. Etc."
464,Paweł Polański,1,"December 30, 2016",6,"The app keeps on improving and I like to thank the developers for that but it is still a chore for me to do anything in it. Buying a ticket is especially the hardest thing to do. No PayPal support, long and hidden process for the ticket purchase, defining start location even for a bundle of 4 tickets which is ridiculous. The initial time I bought a ticket it took me about 20m to setup everything. UPDATE: I'm now not able to use direct credit."
465,Nasia Nikolaou,3,"January 8, 2017",0,Updated version's only drawback
466,Alexander,3,"November 19, 2016",1,Complicated
467,Alessandro Bellini,1,"January 30, 2017",0,"Buy a ticket then close the app. Open again: Im logged out, so cannot access my tickets. Try lo login again but the password field always redirects the focus on username. No way i can write the password. No login.   I'm risking a fine. Not acceptable."
468,Arvid E.P.,1,"November 15, 2016",4,Comically bad
469,Calvin Hoenes,2,"November 28, 2016",0,"App ok, ticket purchase process is aweful"
470,Mark Saku,4,"December 17, 2016",1,Better
471,Sanja,5,"September 26, 2016",4,Very useful
472,Martin Grund,1,"January 3, 2017",1,Cannot enter password
473,A Google user,1,"December 9, 2016",1,"Great until it crashes. Best case your card is charged twice, worst case you end up without a ticket and get a 60e fine. Not quite ready yet."
474,Fabricio Brasiliense,1,"December 19, 2016",2,Broken
475,Marino Petrioli,4,"September 22, 2016",5,nice app
476,Vojtech Remes,5,"September 9, 2016",2,THE app for traveling around Berlin
477,David Kelsey,5,"January 1, 2017",0,"This app is an absolute must if traveling to Berlin.  You can plan your journeys weeks or months before you travel.  When you get to Germany your in real time so it matters not whether you are late or early, the app gives you your connections to get to your destination.  Plus if you have already put in start and finish points of journeys prior to travel you can highlight them immediately.  I've found no bugs or glitches, it all seems smooth and seamless.  Highly recommended."
478,Sam Matthews,4,"November 27, 2016",1,Simple
479,Spunky Bunks,5,"November 9, 2016",1,This foreigner loves it!
480,Péter Bencze,4,"December 19, 2016",0,Fairly good but...
481,A Google user,1,"October 7, 2016",0,Big gaps in data
482,Elias Atahi,1,"January 5, 2017",2,"Can't log in, focus keeps jumping back from password field to user name field."
483,Philipp Römer,1,"November 7, 2016",3,"Update, zwischendurch Upgrade auf 2-3 Sterne. Jetzt aber nach Neuinstallation kein Login mit altem Account möglich. Weiterhin 1 Stern."
484,Ira Nushh,3,"February 24, 2017",1,"""Small bug fixes"": why do you need access to the camera in this update then?"
485,Christian Evans,5,"October 3, 2016",1,Very convenient
486,A Google user,2,"October 28, 2016",0,BVG App
487,Norman Rosario,4,"December 30, 2016",2,Sehr praktisch
488,Vincent MAKOUL-BLONDEAU,5,"November 17, 2016",0,Really handy !
489,Long Pham,5,"February 10, 2017",0,"This app is great, w/o it it seems so hard to find the suitable path in berlin where has the great and complex transportation system."
490,Nikolas Dirk,4,"September 10, 2016",1,"Ganz gut,"
491,qwertz ztrewq,5,"January 24, 2017",0,Super App! Hat alles was man sich wünschen kann! Zeigt auf Druck alle Stationen der Linie und für Fußwege wird sogar ne Karte angezeigt. 1a
492,Gianluca Rondinini,1,"December 2, 2016",0,"Horrible  app, a bug gate"
493,Ervin Moczni,1,"December 2, 2016",0,Unbenutzbar
494,vaishnavi kurdukar,4,"December 21, 2016",0,Super
495,Iratania Tiaradewi,4,"October 19, 2016",0,Good direction
496,Fara Goldberg,4,"September 23, 2016",2,Good and handy
497,Hukam Singh,5,"December 31, 2016",1,Es ist immer punktlich ich stolz auf dieses system weil ich bin in deutchland
498,Apro Choudhury,1,"December 31, 2016",3,Cannot log in
499,Carol McGuigan,5,"November 27, 2016",1,Super
500,Chris Scott,1,"January 25, 2017",0,"Can't even log in! Can no longer enter password to log into account, maybe someone should probably fix that...."
501,Livins Varghese,5,"September 4, 2016",2,Helpfull
502,Sowmya U.K.,5,"November 26, 2016",0,Very useful
503,Jagdeep Amit,5,"October 24, 2016",0,Easy and handy App
504,Ventura Del Monte,2,"October 29, 2016",0,Buggy
505,Deirdre H,4,"October 17, 2016",0,Convenient for city travel
506,Mikita Fedarenka,5,"September 10, 2016",0,Nice app and getting even better with every update. No need to care about coins anymore.
507,Bea Z,5,"November 27, 2016",0,Good
508,A Google user,4,"October 27, 2016",0,Good Travel App
509,Samanta Boero,5,"January 18, 2017",0,"Great app for having flexibility to buy tickets without needing coins, notes or queuing"
510,azim bijoy,5,"December 23, 2017",0,Awesome One of the best app I have ever seen. Simple first well
511,Dominik Zarzecki,4,"October 6, 2016",0,Usefull app
512,Nasser Nasser,4,"September 28, 2016",0,Very good
513,alan peacock,5,"December 7, 2016",0,Lifesaver
514,Borna Abramovic,5,"September 20, 2016",0,Praktisch!
515,Anton,3,"January 9, 2017",0,Is there a way to add widgets for this app? Would be very helpful.
516,Alireza JK,4,"January 13, 2018",0,A little bit complete
517,Olivia Newbold,5,"November 10, 2016",0,Super helpful
518,A Google user,5,"November 2, 2016",0,Love it
519,Ahmed Elkalliny,5,"September 6, 2016",1,Excellent
520,Olivia Kuntz,5,"December 21, 2016",0,So helpful!
521,Armin Krahl,2,"October 10, 2016",0,"Was für eine schlechte Umsetzung einer so tollen Idee... Eine Schande für eine Tech-Stadt wie Berlin! Das Registrierungsformular ist furchtbar - wieso wird die Adresse hier gebraucht, aber als Location ist sie nicht nutzbar? Kaufen kann man nur die offline bestehenden Tickets möglich mit gebundenen Locations - kein Check on the fly wie bei Touch &amp; Travel möglich. Payment means sind nur über den Kaufprozess hinzuzufügen und gar nicht zu verwalten. Für Verbindungssuche ist die Öffis App sowieso besser."
522,Febin Raju,5,"September 27, 2016",0,User friendly!
523,A Google user,5,"October 18, 2016",0,Funktioniert super!
524,Evgeny Viner,5,"November 3, 2016",0,Great app
525,Rory Cussen,5,"January 29, 2017",0,Excelleng up to date information and very easy to use.
526,mohammad alyounes,5,"September 18, 2016",0,nice
527,Biniam Gebregergs,4,"December 5, 2016",0,A very useful with an updated information app.
528,Beatrice Gruendler,5,"September 18, 2016",0,BVG
529,Eka Rakhman Priandana,5,"October 24, 2016",0,Awesome
530,Chris Begley,4,"December 14, 2016",0,Gives better results than Google
531,Neel Bingi,4,"September 18, 2016",0,Mr
532,barbarella bernice,5,"December 18, 2016",0,Pretty helpful! 🤗
533,Bright Bright,5,"January 28, 2017",0,Very nice and cool.
534,A Google user,5,"February 7, 2017",0,Very useful!
535,A Google user,5,"November 5, 2016",0,fast. easy. precise
536,Noël El Fontroussi,3,"October 28, 2016",0,Improving and overall functional
537,Tonio Süßdorf,5,"January 12, 2017",0,fast &amp; easy search
538,marcel noah,2,"January 19, 2017",0,Nothing
539,nugroho uji,5,"February 23, 2017",0,Nice &amp; useful
540,NerminS88,5,"September 19, 2016",0,Love it
541,Shakeel Ahmad,5,"September 30, 2016",0,Love it
542,Marcel Pintó,1,"August 30, 2016",2,Need better QA!
543,Franziskus Nakajima,2,"August 29, 2016",2,Gekaufte Tickets schwer zu finden
544,Nicolas Balcazar,4,"August 25, 2016",2,Wow!
545,Christian Wischnewski,4,"August 25, 2016",2,Neue app recht gelungen!
546,Richard Palm,2,"August 25, 2016",1,Seit heutigem Update werden meine Tickets nicht verlässlich angezeigt
547,Eugene Wallace,5,"August 31, 2016",0,Only way to travel
548,A Google user,4,"August 30, 2016",0,"Fairly accurate times. Would be nice to be able to look at the routes choosing them by their numbers (U2, M5, S8, etc)"
549,A Google user,5,"August 30, 2016",0,Wow von Bangladesh
550,Kenny Kremerman,5,"August 30, 2016",0,Love the new UI
551,Thore Meyer,5,"September 16, 2016",0,Loved
552,Simar Baidwan,5,"August 31, 2016",0,Cool
553,A Google user,3,"August 21, 2016",0,"This is currently the best app for current routing information for the S-Bahn, Regional and BVG transportation systems in Berlin. — There are still some UX issues like the app showing routing info for 1 hour in the past instead of current times and the form for buying tickets and passes could be improved by automatically retrieving the same information from my Google Account."
554,Constantin Bueker,1,"June 18, 2016",4,Grausige usability - teure fehler
555,Ana Starinskaja,1,"August 25, 2016",0,They fail to come correctly on purpose to demand higher salaries. They are in fact very rude people that will make anything even stalk you while you use their transport to motivate you to fight with their management for them to have higher salaries. Tickets are very expensive. This service makes bad reputation of being late even for those who are very punctual. Comming 30 minutes earlier than neccesary doesn't garantee comming on time. If you're late to work it's only your fault.
556,ernest dios,2,"July 23, 2016",0,well is good to plan journeys even better than Google maps sometimes. But often you buy a ticket and it doesn't show in your purchases. also funny bug that gives you wrong password note and you just need to insist until it let's you go through. Then I can't reset password for a web error. My god guys I have friends that can do this app more stable.
557,Andrej Schmitt,1,"May 18, 2016",4,"Good app, bad behaviour"
558,Jeremy Hanner,1,"May 26, 2016",3,could not register an account
559,Paul Boeck,3,"July 23, 2016",0,Mediocre app
560,Tom Raz,1,"May 24, 2016",3,Buggy as hell
561,Kristiyan Katsarov,1,"July 4, 2016",0,Bad design
562,Flueschi McFluffems,1,"July 7, 2016",0,"Die Verbindungen, die einem teilweise empfohlen werden, sind der reine Witz. Die Anzeige der Verspätungen in Echtzeit wäre ja schön, wenn sie den funktionieren würde. Habe gerade eine Stunde lang auf einen Bus gewartet, der nur 11 Minuten Verspätung haben sollte. In der Zeit wäre ich den Weg drei mal gelaufen."
563,A Google user,3,"August 24, 2016",0,Crashes
564,Adi,2,"June 22, 2016",1,When loading the app it shows rides on past!
565,Jemant Anteres,1,"June 28, 2016",0,Startet nicht mehr
566,Roman Krajewski,5,"November 24, 2016",0,Beste app
567,fawad karimi,5,"September 6, 2016",1,Gut
568,Surya Hitam,2,"May 11, 2016",3,No GUI in German?
569,Dennis Klein,5,"January 1, 2016",0,"This app was just perfect for our trip to Berlin. It's very fast and doesn't need much data to present all the traveling info you need. Even amidst the huge new years eve crowd it worked without a hitch. Use this app in combination with a map and you'll travel all across Berlin in a flash. I didn't try the online ticket purchasing, since buying tickets at the station is so much easier and quicker anyway."
570,Sasa Sekulic,2,"January 4, 2016",9,What happened to 4-trip tickets?!
