,name,rating,date,upvotes,review
0,Bjorn Thegeby,1,"May 20, 2020",1,It activated all four tickets of a four-ticket purchase at once. I would like to give it a better rating but that has to be fixed!
1,Robin C,5,"June 12, 2020",0,Fantastic and easy to use!
2,Glenn Dobbelaere,1,"January 20, 2020",9,"In Berlin it apparently is only possible to pay your ticket on the tram with change, bills are not accepted by the machine. Why!? We did not have enough change and could not buy a ticket beforehand because it was a small stop without machine. I installed this app to try and buy tickets. I could not find how to buy multiple tickets at the same time, so I tried to buy them separately. When selecting PayPal as payment method, it required me to install Chrome Browser. Why!? We did not buy tickets."
3,Max M.,5,"June 3, 2020",0,"Stable performance on my phone (Samsung Galaxy S7). Useful features, continuous development and updates."
4,Simon Paag,4,"March 31, 2020",7,"It's a decent app. Don't get med wrong, it's not my favorite app, but hey it's a transport app. Not like the new tinder or anything like that, therefore 4 stars."
5,Spiros Daoudakis,3,"December 25, 2019",9,The application is very good but is missing one very useful feature. When you want to purchase a ticket you cannot set the validity time and you are forced to book the tickets a few minutes before you travel and not in advance.
6,mrow,2,"October 17, 2019",27,"I use this app every day. The basic functionality works well, but it is very frustrating that the found routes in the Trip Planner always disappear when the app is closed for a while or when displaying a ticket. I often want to look up at which station I have to change (and on which platform I have to go for the connection, etc.) while I'm on a bus or train already, and it's always gone and I have to repeat the search, which then shows different results because it's a later time. please fix :("
7,Benedict Kalus,2,"April 19, 2019",21,"To start on a positive note, the app is more reliable than Google maps, which is absolutely rubbish in Berlin. However, the BVG app is also pretty useless when you need realtime information, e.g. when services on an underground line are cut. In that case, it showed me, that I should take the line without service with a little warning triangle that trains are actually not going without telling me what actually is going. In general, the app also suggested itenaries with unnecessarily long walks."
8,Christopher Till,2,"September 17, 2018",9,"For the last year I've been using app fine. Last 2 weeks, I've had pre bought tickets magically activate. And missed several s bahns due to connection time out. The one occasion I took the gamble, a ticket inspector took pitty on me after saying there are lots of problems at the moment. Gone old fashioned until the issue is resolved"
9,Roberto Arias Alegria,1,"September 19, 2018",11,"Incorrect charges due to a glitch in their systems and on top of that they want to charge late payments 😡 Put your act together BVG, that never happens in the Apps of major cities. For other users: be careful and try to use pre-paid cards with limited credit. BVG might try to charge you randomly later a then it'll be up to you to fight this with the bank."
10,Katarzyna Bednarz,1,"September 19, 2018",17,"The app is absolut rubbish in the last week or so- l've been charged twice the double amount on the same purchases of a 4-Trip ticket and a 4-short-trip ticket. When I recalled the charges through my bank, I fast immediately got an invoice from Logpay with an invoice for the incorrect amount plus almost 10€ of late fees to pay and my account has been blocked for further usage...! also, they have already charged the correct amounts on another day, so I guess I owe them nothing and i received a vague email from BVG apologising and telling that they are sorry for the technical issues and double bookings, and all is good now, but my account is still blocked and unusable!!!"
11,Pawel R,3,"October 8, 2019",23,New update is bad. Before it worked flawlessly for me. Buying new tickets was fast and even the pre purchased tickets were visible and easy to access. Now it takes forever for them to show up and I have to refresh the app several times and turn off my wifi for it to show up so you can select it. Why did you have to break what worked fine?
12,David Vartanian,3,"October 7, 2019",10,"The UI is getting better. However, the service behind is getting worse. Services are not reliable (sometimes it shows buses coming on time but they don't even come), and it's not possible to report incidents. However, reporting problems via the web form also doesn't make BVG react. Delays, driver's lack of education, services that never came, nothing seems to be taken care of. I'm paying 64 euros per month for mediocrity not compatible with the quality and punctuality Germany promotes abroad."
13,Frank Tinschert,2,"February 4, 2020",6,"Too many steps to buy a ticket, difficult to manage multiple payment methods. No option to start with ticket purchase as home screen. Works ok though."
14,Ryan Walker-Gray,1,"September 17, 2018",16,"This app is magical! You can watch busses evaporate right before your very eyes! Need to get to work? Poof! That bus is gone now! Been waiting at your stop for ten minutes? Wait another ten, the bus on the app was just an illusion! I can't wait to pull off a disappearing act of my own, from Berlin, forever!"
15,Andreas Goedecke,2,"September 17, 2019",6,"App is fine *if* it's actually showing what's happening. With recent construction around Potsdam's S-Bahn, the App is incredibly inaccurate. Either it shows trains that are not running, or it's showing trains that are running normally as canceled. Might be a problem with the database - but it's really not that useful right now."
16,Lorenz RUDKIN,4,"September 17, 2019",9,"For a first test: very well, helped me enormously to make my way thru the ""jungle"". As an only occasional visitor to the city, it was much less hassle free than before. Also great: the pedestrial path to the destination is included! The tutorial is quite condensed, more info would b helpful. But the essentials can be learned fast. Some additional alarms would be desirable tho: - when the goal station is approaching - when the wrong direction is taken (by foot or public transport)"
17,Laura Broenink,4,"October 2, 2019",7,"The email confirmation link does not work (just leads to a 404 Not Found page), yet without confirming your account, you cannot buy tickets. Kind of useless like this :( Update: once I had actually arrived in Germany, I gave it one more try and suddenly I could validate my account. App works decently now. Is it region locked or something? (If so, it would be helpful if it actually says so, instead of these broken links when trying to access from outside Germany...)"
18,Lona Suark,2,"December 21, 2018",57,"the ticket you buy is valid immediately without option for later validation. Not possible to buy tickets for people traveling with you since ticket is personal. App lacks Help files, FAQ and clear instructions! No customer support service and SEPA Direct Debit always rejected. People at BVG offices know nothing about the app. Pathetic."
19,Natd,3,"September 30, 2019",7,"Too many steps to validate the already bought 4 trip tickets. Also, it happens often that you buy the ticket and it takes ages to download. Not useful if you are in a hurry."
20,M K,5,"May 22, 2019",16,"Berlin - a modern metropoly with great public transport, but no ticket machines, and even if you find one, they only accept coins. I couldn't survive without this app. Route planning is also a life saver."
21,Jon Huskell,1,"October 18, 2019",8,"Beware!!! Don't buy tickets through the app! You will lose your money. Tickets get unvalidated after purchase before you can use them. Looks like a big See other users are experiencing same issues I wrote them, they will ignore you and you won't get a refund"
22,Igor Madjeric,1,"January 2, 2020",2,App is unstable most of the time I still have to buy ticket instead of using app because of server issues.
23,oscar sandoval,2,"September 12, 2018",3,The app charges you doble for the tickets. I bought a day ticket and because they take to long in charging you I didn't notice but then I bought a short trip ticket and they did again. So instead of charging 7 euros they charged 14 and the same thing for the short trip ticket
24,Christoph Wurst,1,"November 14, 2019",21,"Tried to purchase tickets, but app didn't accept my password. Regardless of that it charged the amount from my PayPal account. Now the conflict resolution tells me this shouldn't even be possible. Is this a joke? Other people from Berlin know similar stories. Don't use this app."
25,Riyed Rony,5,"May 19, 2020",0,Most daliy usefull apps.One of the best transport system in the world. Happy for service. Keep servicing Berlin.
26,Felix Blind,3,"May 22, 2019",8,it has a very small limit for password length but it doesn't tell you which. makes it very frustrating to set passwords. everything else works fine.
27,Samuel Alder,5,"April 9, 2019",18,"Great app, so useful to be able to buy tickets on my phone instead of standing in line at a machine for them! also more or at least equally accurate to Google maps, great incase that is unusable for any reason thanks for developing it"
28,Leonard Davies,5,"January 22, 2020",3,"Great app for planning integrated transport around Berlin. Trams, bus, s bahn, ubahn and regional,"
29,PC Southworth,2,"November 19, 2019",7,Generally useful but a little hard to navigate. After last update the credit section doesn't show up anymore under tickets which is a major problem. Would have to go to expired tickets first and then to credit to access my credit tickets. Has to be fixed.
30,Eduardo Heinen,5,"December 11, 2019",6,I would love to have the cards to see the transports nearby and how long for them to arrive. iPhone has it and it is awesome. I don't need to open the app to see how long my bus will take to arrive.
31,Norman Blackburn,3,"September 24, 2018",2,Does pretty much as expected. I don't use it to buy tickets so much though. I much prefer the old fashioned way of a physical ticket in my hand.
32,Luther Lebtag,2,"November 4, 2019",2,"Since the last update my credits do not appear properly. It seems the app needs to update before the credits can appear. Not cool, it used to work properly before. Please fix it."
33,Lucas Blume,4,"May 30, 2020",0,Easy and comfortable design.
34,Malcolm Vernon,5,"March 4, 2019",7,Top quality Berlin journey plan and ticket app. Link you card and put start and end adresses and you wont need to figure out the Berlin transport pricing structure. Lovely maps integration means you can do even multimodal journeys like a local
35,Kornel Hoekerd,1,"July 30, 2019",6,"Wow. You can select countries other than German, but it will not accept the postal code no matter how I write it, even does not accept Berlin postal code. So impossible for me to use......."
36,Ognjen Simić,5,"March 6, 2020",2,Super useful and functional! Makes Berlin easy to navigate. 5/5
37,Martin,5,"May 22, 2020",0,"Very much a strong exception to the rule ""Govt. style apps are always awful"""
38,Jonas Frankki,2,"November 20, 2019",1,After update - Tickets take forever to download - almost got a fine though I had bought the ticket in advance - Tickets &amp; Favorites are harder to find Just undo this update please.
39,Menno van der Graaf,4,"February 16, 2020",3,"Interface is sometimes a bit too overwhelming, but man this app can do everything"
40,Tom Bergman,1,"September 20, 2018",1,"This app used to be amazing, but since the new update it is super slow. Constantly 'downloading resources' and timing out 2-3 times before i can activate a ticket"
41,A Google user,4,"March 22, 2019",5,"Very good app, can be fiddly at first, especially when searching for destinations, hence four stars, but otherwise highly recommended."
42,Adam Glover,3,"August 13, 2019",9,"seems to do the same as the ticket app, yet you cant see your purchased tickets in this app, and vice versa. Room for improvement!"
43,Marcos Doellerer,4,"September 17, 2019",5,"Very good, all information available, can make search for recent past, which is useful since it does not save info after block, unblock screen"
44,Nicole Anansi,3,"September 22, 2019",2,Quite ok...but some suggested itineraries forget the most obvious ones...especially of travelling with luggage it's no fun to walk 1 mile when the next bus stop is around the corner
45,Khaled Alaswad,1,"November 6, 2019",4,I don't recommend anyone to buy tickets from this app. I bought online ticket through this app and when the control wanted to check my ticket the app just didn't work then they charged me 60€.
46,Marc LUDWIG,4,"April 16, 2019",1,"Great app. Unfortunately, you can only purchase one single Ticket. No options for additional passenger / familiy members."
47,Sanny Minga,5,"August 12, 2019",6,"Thanks BVG! You can still improve through, in updating the changes faster, during strikes, engine breaks, functional issues for example."
48,Mike Laing,5,"November 16, 2019",8,"Fast, accurate, comprehensive and so easy to use. Doesn't crash or act up....great app!"
49,Anwar Kholid,4,"September 22, 2018",3,"It works very well. Bus schedule is not always correct / on time, but come on......a bus has to compete with other cars."
50,Kristina Gybasova,5,"August 25, 2019",3,"Excellent app. English interface! Shows delays, platforms, allows to buy tickets. Simply brilliant."
51,Khder Omar,2,"November 30, 2018",10,"Some good features but bus times are always confusing ...the bus that never come, the app assumes is on time or delayed ..."
52,Daniil,5,"March 10, 2019",6,"Works fast, and stable. Easy to buy tickets. Nice visuals"
53,david mbadiwe,1,"January 30, 2020",0,"Not at all helpful for a new non Dutch speaking foreigner, it always gave me deceitful route and made very frustrated I won't recommend it to anyone"
54,Johny Setiawan,2,"October 23, 2019",0,"strange suggestion of the connection, sometimes really useless and wrong. need to be corrected a lot."
55,Djaik Navidson,4,"August 2, 2019",0,should be able to show tickets without having to stop navigation. otherwise great
56,Tim Wright,5,"March 15, 2019",3,Great planner for travelling in Berlin as well as convenient ticket purchases.
57,A Google user,5,"December 2, 2018",8,"Fantastic app, helped us a great deal when visiting Berlin. Would highly recommend."
58,Roelz Yermain,1,"August 11, 2019",13,Can't even verify my email address so couldn't make an account. Couldn't do anything. What a disaster
59,Wtarm Kantoni,4,"November 18, 2019",0,"Pretty good app, with a lot of functionality and information, but the interface is sometimes fiddly."
60,Benjamin Tammi,5,"December 5, 2019",1,So easy to use. Love the map and ability to purchase tickets. Don't use any other app.
61,Josh Junon,5,"February 7, 2019",4,"Great app, especially since Google has been getting S41 and S42 backwards lately."
62,Marcello Galhardo,1,"March 12, 2019",5,Once you add a payment method isn't possible to delete. I can't delete my credit card information. This is unacceptable. 🤦‍♂️
63,Itamar Ben-Nachum,2,"February 16, 2019",5,"the oije timplan dose nit update fast enough. that is an issue when a train is running late, and you are looking for information or other travle Options"
64,Doğuhan Taşdemir,5,"May 19, 2019",1,It is very conveniently used to check transportation routes and times.
65,Brett Veitch,1,"August 8, 2019",2,"freezes and stops working frequently. the screen stays up, just no buttons work."
66,Bernd Krohn,5,"February 15, 2020",1,"For Berlin necessary, timetable, gates, always upto date, without it you are absolutely lost,"
67,R Aslan,1,"February 11, 2019",3,app gave incorrect information. left me waiting in the cold waiting for a bus that never came and didn't tell me about options that did exist.
68,Snir G,4,"February 13, 2019",2,"Overall, very user friendly app for buying tickets &amp; trip planning."
69,Mark Krayenhoff van de Leur,4,"March 23, 2019",0,"usually pretty good, but sometimes balky and unresponsive."
70,Petr Novak,5,"November 28, 2018",4,Able to calculate with walking. Able to create shortcut of result. And many more....
71,Joy W,1,"September 30, 2019",4,"Bought 4 short trip tickets today only used one but expired in 3 hours and i haven't even used the other 3 tickets, can i get my refund? Also if its a bug please fix it"
72,Stephanie Lorenz,5,"July 14, 2019",12,It's a lifesaver for getting around in a very big city with a VERY thorough public transportation system. Only hangup is trying to learn how to read it correctly at first.
73,Melvin Kenyon,4,"March 27, 2019",3,Pretty easy to use and essential for travelling in Berlin as a tourist
74,barry carey,5,"November 4, 2019",6,"Fantastic,I work at Kilkenny Irish pub in hackescher markt,I always recommend this app to our guests as it's a great app and very easy to use. I love it"
75,Scott Grigg,4,"June 27, 2019",2,A great app if you need to find your way around Berlin with the BVG.
76,T Alling,5,"August 3, 2019",2,Very helpful for sonebody not familiar eith the city and needing a guide for how to get just about anywhere!
77,Richard Opoku,4,"September 19, 2019",0,I found it very much interested. Arrival time exactly. Very good to rely on
78,Dimitri,5,"December 7, 2018",4,Just right for planning trips around Berlin by public transport. I've been using it for years.
79,Sebastian Uribe,2,"February 7, 2019",2,"Used to work very well, lately it freezes a lot"
80,Simon Sotak,1,"March 22, 2019",0,"I want to buy ticket,but it says no payment methods are available. So why wont it let me add a payment method ?"
81,A Google user,1,"December 8, 2018",6,"Why does a transport app for a specific City/region want access to my contacts??? #""&amp;-+&amp;_*¥$π√∆π !!!"
82,scud1337,2,"December 10, 2018",1,"Slow and cumbersome, Öffi App is much better for slow connections"
83,Constantine Makeev,5,"November 27, 2019",4,Great and very convenient app. Would definitely recommend to anyone!
84,A Google user,5,"January 5, 2019",0,Helps me get around the city very well. Trip planner is very well done
85,Simone Marini,4,"February 18, 2020",2,"Is a very good and useful app, is also simple to use"
86,Waleed,3,"December 8, 2018",3,"If the ticket must contain your name, please add support to puy the ticket for someone else."
87,MichaelvD,4,"April 14, 2019",1,Pretty good easy way for first time visitor to find out how to get somewhere
88,jade xo,5,"September 28, 2019",2,"Tourist in Berlin, does the trick in giving me time planners but haven't used option to purchase tickets through app"
89,Patrick Murray,5,"September 9, 2019",1,"Excellent all-round application, both for planning and buying tickets"
90,Martin Wynne,1,"November 29, 2018",0,Authentication doesn't work. I couldn't log in.
91,Kiran Pulicheri,4,"April 15, 2019",2,Very useful especially for the ones who is new to Berlin
92,Per Zennström,5,"September 13, 2019",2,Hard to belive that BVG created such an incredible God app 😉 Chapeau to the user experince team!
93,Matthew Clugston,1,"May 11, 2019",1,"way too slow, your a big company, with resoucre and $$, sort it out. The ticket machines are rubbish too"
94,Shay Erez,5,"April 29, 2019",0,ultimate guide to ride in berlin easy and comfortable
95,A Google user,3,"September 20, 2018",5,"Meh. It'll help you but honestly you're probably better off using Google Maps on public transport mode. By the way, always leave 3-5 earlier than the app tells you to. You'll thank me later."
96,Max Malkiel,5,"October 4, 2019",3,It's in ENGLISH ! ♥♥♥ Thank you!
97,Francesco Tazzer,5,"March 20, 2019",3,Very useful about to get around our beloved Berlin.
98,Nobody Alias,5,"July 27, 2019",4,just works - no fluff i can see - not rating privacy friendlyness
99,Robert G. Showers,5,"January 10, 2020",0,This is the official app. For me it worked flawlessly.
100,A Google user,3,"March 7, 2019",2,Unreliable. Broken-down trains which run empty to the depot and cancelled trains are still shown as in active service.
101,A Google user,3,"September 16, 2018",0,The app is fine but the underlying infrastructure is not.
102,Hristo Nachev,5,"November 22, 2019",0,"Really easy to work with, every needed info is there for you"
103,Francesco Carzedda,5,"September 13, 2018",1,Im using it for my trip in Berlin and it's great !
104,Afia Krapah,5,"June 28, 2019",9,this app has been a lot of help to me to find my way in and out of Berlin.
105,George Adunbi,5,"January 10, 2020",0,Easy to use. It's accurate.
106,Florian Helmchen,2,"July 19, 2019",2,cannot complete purchase on phone. asks for name but doesn't save and proceed after i enter my name.
107,A Google user,4,"December 13, 2018",0,At times it does not show the shortest route.
108,Yashesh Bhatia,4,"April 11, 2019",0,easy to use app and very accurate.
109,Ian Faultless,5,"March 3, 2019",0,Excellent and easy to use
110,Maria Herchenbach,3,"November 1, 2019",0,the maps and walking instructions are so bad
111,Simon Dawes,5,"May 5, 2019",0,extremely easy to use &amp; helpful
112,Claudia Fisher,5,"September 26, 2018",0,"As a South African in Berlin, this app really made my travelling around the city much easier."
113,Margaret Tarrant,5,"February 6, 2019",0,Easy to use. Good options in real time.
114,Maik Kobald,3,"August 29, 2019",0,Map integration is missing
115,Penghui Li,5,"October 1, 2019",3,It's very helpful to show the platform.
116,Wahid Murad,3,"September 15, 2019",0,I would suggest to make more easier UI
117,stef barsch,5,"March 24, 2019",0,Exceptional user experience.
118,Restrry mike,1,"September 17, 2018",2,Permanent error doesn't allow to use
119,hans petterson,5,"January 14, 2020",0,best public transport app for Berlin
120,A Google user,3,"October 29, 2018",6,Getting stuck too often.
121,Demi Barclay,5,"August 14, 2019",0,Convenient for buying tickets
122,Paul Melcher,1,"November 18, 2019",0,"Screw ABC monthly tickets, nobody needs those anyway..."
123,A Google user,5,"March 8, 2019",1,very simple and easy to understand
124,Alex Carroll,1,"November 4, 2018",5,No info as to why buses dont show up. App is not GDPR compliant.
125,A Google user,1,"October 15, 2018",1,Autoload makes it way too slow
126,Bruno Lima,5,"February 2, 2019",0,better than google maps and apple maps for public transport
127,Bassam Hashem,4,"October 6, 2018",0,Need more development to be more practical
128,Georgi Popov,5,"January 22, 2020",0,excellent and useful!
129,Piyachai Chu-Ame,5,"September 21, 2018",1,Good for Tourist like me for a first time in Berlin.
130,Kailas Patil,5,"October 15, 2019",0,Can you guys put warning message in english
131,Alexandra Anușcă,4,"June 24, 2019",0,it's a good and very useful app
132,A Google user,4,"February 25, 2019",1,have only used it for routes and it works well for that
133,Gigi Taha,5,"May 2, 2019",1,gets me to where I am going hassle free and on time.
134,Matteo Giomi,2,"November 20, 2018",1,It is super slow
135,Catherine Nduta,5,"August 4, 2019",8,"its the best.i can go anywhere in the city, just give me the address and the App, I'll be at your doorstep right on time."
136,Mamdouh Abdelaziz,5,"October 23, 2019",0,"I like what you're doing here, keep making it better, it's becoming an essential part of my daily life."
137,Les Capitano,5,"March 13, 2019",2,very good. even informed me of a wildcat strike on the buses
138,Hartmut Schweda,2,"June 14, 2020",0,Hard to use
139,Charles Driver,3,"May 16, 2019",0,why can't i buy a monthly bicycle ticket?
140,Tanaya Batabyal,5,"March 21, 2019",0,must have if you are travelling in berlin
141,Timothy Foster,3,"September 10, 2019",0,Can you buys U bahn ans S bahn tickets with this app?
142,A Google user,4,"November 15, 2018",0,Great for Berlin and Brandenburg
143,Liz McGill,5,"October 11, 2018",0,great help to find way around
144,Ajayi Adesewa,5,"April 10, 2019",0,it nice it show me the way
145,Saqib Mughal,5,"October 1, 2018",0,Works good for me
146,Fritz,5,"April 27, 2019",0,it's very good
147,Silence,1,"August 11, 2019",0,very inaccurate information
148,Alexandros Giovanos,1,"June 18, 2019",0,awful and unreliable
149,Abhishek Chavan,5,"September 13, 2019",0,Excellent Nice and very helpfu
150,Ibukun Olaniyan,5,"June 12, 2020",0,Good
151,dete kafka,4,"May 17, 2020",0,the app restarts too often and loses the details of my trip 2-3 times per trip.
152,Nabil Jamil,5,"May 9, 2020",0,Sehr gut
153,Paloma Karaokcu,1,"May 2, 2020",0,"Eine ganz neue Angewohnt ist es ,das die Busfahrer der Fahrplan überhaupt nicht mehr interessiert und wie die Verrückten-zum Erbrechen schlecht werdend-durch die Stadt rasen und die Fahrgäste überhaupt nicht mehr zur Kenntnis nehmen 😒😤😡"
154,Mareen Elu,5,"February 5, 2020",0,"Funktioniert gut. Mit Echtzeit und Verspätungsminuten. Das einzige, was ich verbessern würde, ist, dass man angeben kann, in welcher Tram/Bahn man gerade sitzt. Z.B. von ""S1 Friedrichstraße"" nach XYZ, falls man schon in der Bahn ist, aber nachgucken möchte, wo man am Besten umsteigt."
155,F B,1,"March 20, 2020",0,VORSICHT! Fahrscheine nicht übertragbar! Nicht mal die Monatskarte trotz regulären Preis! Besser mit den Füßen abstimmen und zurück zu Papier. #uninstall
156,Djulie-Joanita 12,3,"November 21, 2019",0,Die App ist eigentlich super das einzige was mich stört ist das sie den 197 anzeigen der 20 Minuten nach an der Spremberger Strase ( Richtung hohenschönhausen) eintreffen soll aber nie wirklich NIE um 20 nach da ist der blöde Bus fällt immer aus da können die das auch gleich ausstreichen mit das er 20 da sei.
